{"schema_version":"daily-compiler-edition-bundle-v1","edition_date":"2026-10-07","status":"BUNDLE_READY","editorial_contract_version":"daily-compiler-editorial-contract-v1","stories":[{"id":"dots-always-on-agents","headline":"OpenAI dots brings persistent assistants into everyday work","focus":"Agents for Everyone","source":{"title":"OpenAI takes on Meta with dots agent in autonomous AI push","publisher":"Reuters","url":"https://www.reuters.com/business/openai-takes-meta-with-always-on-dots-agent-enterprise-ai-push-2026-09-29/","published_at":"2026-09-29","retrieved_at":"2026-10-06T22:17:30Z"},"reading_time_minutes":4,"topics":["persistent assistants","delegation","connected apps"],"coverage_labels":["7-day fallback","persistent agents"],"summary":"OpenAI introduced dots at its September 29 Developer Day. The product is designed as a persistent assistant that can maintain continuity across tasks and connected applications instead of starting from a blank conversational state each time.","why_it_matters":"The product shifts attention from single answers to continuity over time. Users will need clear goals, sensible permissions, and review points when they delegate recurring work.","related_coverage":"The enterprise-context story explores the organizational knowledge and permissions that make persistent assistants more useful.","image_alt_intent":"Mechanism diagram showing goals, context, connected apps, review points, and ongoing task state around one persistent assistant.","agent_skills":false,"permanent_route":"/stories/2026-10-07/dots-always-on-agents/"},{"id":"sagemaker-agent-skill","headline":"AWS packages SageMaker inference expertise as a reusable agent skill","focus":"Agents for Everyone","source":{"title":"New agent skill: Amazon SageMaker optimized generative AI inference for your coding agent","publisher":"AWS","url":"https://aws.amazon.com/blogs/machine-learning/new-agent-skill-amazon-sagemaker-optimized-generative-ai-inference-for-your-coding-agent/","published_at":"2026-10-05","retrieved_at":"2026-10-06T22:17:30Z"},"reading_time_minutes":5,"topics":["Agent Skills","MCP","SageMaker","inference optimization"],"coverage_labels":["Agent Skills","24-hour priority"],"summary":"AWS introduced the `aws-ai-ml` skill through the Agent Toolkit for AWS. It gives compatible coding assistants reusable expertise for benchmarking SageMaker endpoints, comparing performance, recommending configurations, and producing inspectable SageMaker Python SDK v3 code.","why_it_matters":"This is a concrete example of a reusable Agent Skill rather than a one-off prompt. Teams can package specialist guidance once, load it where compatible, and keep recommendations tied to measured evidence and visible code.","related_coverage":"The inference-latency story shows why the benchmarking and configuration decisions embodied in this skill matter at system level.","image_alt_intent":"Pipeline diagram showing skill loading, intent capture, benchmark evidence, comparison, recommendation, and inspectable code.","agent_skills":true,"permanent_route":"/stories/2026-10-07/sagemaker-agent-skill/"},{"id":"ironclad-computer-use","headline":"Contracting workflows become measurable AI tasks","focus":"Applied Generative AI for Knowledge Workers","source":{"title":"Advancing computer use with Ironclad","publisher":"OpenAI","url":"https://openai.com/index/advancing-computer-use-with-ironclad/","published_at":"2026-10-06","retrieved_at":"2026-10-06T22:17:30Z"},"reading_time_minutes":5,"topics":["workflow evaluation","legal operations","computer use"],"coverage_labels":["24-hour priority","professional workflows"],"summary":"A collaboration with Ironclad translated representative contracting work into structured training and evaluation tasks. OpenAI reported that GPT-6 Astra achieved a higher average score and lower estimated time per attempt than GPT-5.6 Sol on the research task set.","why_it_matters":"Professional AI needs to preserve business requirements across a complete workflow. Explicit task criteria make it possible to measure whether a finished process actually satisfies those requirements.","related_coverage":"The Atlassian story covers enterprise context; this story covers measurable workflow execution.","image_alt_intent":"State-machine diagram showing intake, rules, approvals, exceptions, agreement assembly, and verification.","agent_skills":false,"permanent_route":"/stories/2026-10-07/ironclad-computer-use/"},{"id":"atlassian-openai-enterprise-context","headline":"Atlassian and OpenAI connect frontier intelligence to enterprise context","focus":"Applied Generative AI for Knowledge Workers","source":{"title":"Grounding Frontier Intelligence in Enterprise Context","publisher":"Atlassian","url":"https://www.atlassian.com/blog/company-news/atlassian-openai-strategic-partnership","published_at":"2026-10-06","retrieved_at":"2026-10-06T22:17:30Z"},"reading_time_minutes":4,"topics":["enterprise context","Teamwork Graph","knowledge work","human-agent collaboration"],"coverage_labels":["24-hour priority","enterprise grounding"],"summary":"Atlassian and OpenAI are deepening their partnership around the idea that frontier intelligence needs access to the goals, knowledge, people, and processes that shape enterprise work. Atlassian positions its Teamwork Graph and systems of record as a context layer for reasoning about live organizational state.","why_it_matters":"Better models alone do not solve the enterprise context problem. Useful workplace AI must identify the right project, decision, owner, permission, and source of truth, while keeping people involved in consequential work.","related_coverage":"This complements persistent assistants by showing the organizational context and permissions needed for continuity to become useful rather than noisy.","image_alt_intent":"Layered-system diagram showing model reasoning grounded through identity, permissions, organizational context, systems of record, workflow actions, and review.","agent_skills":false,"permanent_route":"/stories/2026-10-07/atlassian-openai-enterprise-context/"},{"id":"embeddinggemma2-edge-retrieval","headline":"EmbeddingGemma 2 brings semantic retrieval onto the device","focus":"Technical AI Engineering","source":{"title":"Bring multimodal semantic search to the edge with EmbeddingGemma 2","publisher":"Google Developers Blog","url":"https://developers.googleblog.com/en/google-ai-edge-with-embeddinggemma-2/","published_at":"2026-10-06","retrieved_at":"2026-10-06T22:17:30Z"},"reading_time_minutes":5,"topics":["multimodal embeddings","edge AI"],"coverage_labels":["24-hour priority"],"summary":"Google introduced EmbeddingGemma 2 for compact multimodal embedding workloads on edge devices.","why_it_matters":"The release gives engineers another option for building responsive semantic-search experiences close to where data is created.","related_coverage":"The companion infrastructure story examines a different part of the latency stack.","image_alt_intent":"Comparison diagram showing remote and on-device semantic search architectures.","agent_skills":false,"permanent_route":"/stories/2026-10-07/embeddinggemma2-edge-retrieval/"},{"id":"astra-ultrafast-blackwell","headline":"Blackwell and inference optimization push Astra into faster agent loops","focus":"Technical AI Engineering","source":{"title":"How NVIDIA GPUs Help Accelerate OpenAI’s GPT-6 Astra Ultrafast","publisher":"NVIDIA","url":"https://blogs.nvidia.com/blog/gpus-openai-gpt-6-astra-ultrafast/","published_at":"2026-10-01","retrieved_at":"2026-10-06T22:17:30Z"},"reading_time_minutes":5,"topics":["inference optimization","Blackwell","latency"],"coverage_labels":["7-day fallback","inference engineering"],"summary":"NVIDIA says GPT-6 Astra Ultrafast on Blackwell GPUs delivers up to 8x faster token generation than Astra Standard through ongoing inference optimization.","why_it_matters":"Latency savings can compound across repeated model turns in interactive workflows, making infrastructure performance part of the user experience rather than a back-end detail.","related_coverage":"The SageMaker Agent Skill story shows how teams can benchmark and reason about deployment choices that influence the same performance envelope.","image_alt_intent":"Control-loop diagram showing reasoning, generation, tool use, result checking, next-step decisions, and runtime optimization.","agent_skills":false,"permanent_route":"/stories/2026-10-07/astra-ultrafast-blackwell/"}],"videos":[{"title":"Am I paying for a giant model I don't need?","source":"Microsoft Developer","url":"https://tech.hub.ms/all/videos/am-i-paying-for-a-giant-model-i-don-t-need","original_date":"2026-10-01","duration_minutes":4.17,"focus":"Technical AI Engineering","summary":"A short walkthrough of evaluating model routing against a baseline across quality, cost, latency, value, and model distribution.","why_it_matters":"It gives engineers a compact method for deciding whether routing fits their own workload.","verified":true},{"title":"How to protect your repo in 2 minutes with gh-secure","source":"GitHub","url":"https://tech.hub.ms/devops/videos","original_date":"2026-10-04","duration_minutes":2,"focus":"Agents for Everyone","summary":"A brief GitHub demonstration of a one-command repository safety check for everyday development workflows.","why_it_matters":"Short, repeatable checks are useful as AI-assisted development increases the number of automated changes moving through repositories.","verified":true}],"podcasts":[{"title":"Kevin Roose Didn’t Use AI to Write His Book About AI","source":"Uncanny Valley / WIRED","url":"https://www.wired.com/story/the-big-interview-podcast-kevin-roose/","original_date":"2026-10-06","duration_minutes":40,"written_reading_time_minutes":7,"summary":"Kevin Roose discusses The AGI Chronicles, the recent history of frontier AI, and how he used AI for research support while keeping the writing human.","why_it_matters":"The conversation offers a practical pe